{
  "name": "De Zon",
  "type": "Ster · G-type hoofdreeks",
  "fact": "De Zon bevat 99,86% van alle massa in het zonnestelsel. Haar zwaartekracht houdt alles — van Mercurius tot de Oortwolk — in baan. Elke seconde fuseert ze 600 miljoen ton waterstof tot helium, en geeft daarbij de energie vrij die het leven op Aarde 4,5 miljard jaar lang in stand heeft gehouden.",
  "bio": "Een 4,6 miljard jaar oude G-type hoofdreeksster, halverwege haar 10-miljard-jarige leven. De Zon roteert differentieel — haar evenaar doet er 25 dagen over, haar polen 35. Over ongeveer 5 miljard jaar zal ze haar kernwaterstof uitputten, uitzetten tot een rode reus en de binnenste planeten verzwelgen. De gravitationele invloed van de Zon bepaalt de heliosfeer tot ongeveer 120 AE.",
  "links": [
    {
      "l": "Zon — Wikipedia",
      "u": "https://nl.wikipedia.org/wiki/Zon",
      "t": "intro"
    },
    {
      "l": "The Sun (NASA Solar System Exploration)",
      "u": "https://science.nasa.gov/sun/",
      "t": "intro"
    },
    {
      "l": "Parker Solar Probe (NASA)",
      "u": "https://science.nasa.gov/mission/parker-solar-probe/",
      "t": "core"
    },
    {
      "l": "Solar Dynamics Observatory (NASA)",
      "u": "https://sdo.gsfc.nasa.gov/",
      "t": "core"
    },
    {
      "l": "Standard Solar Model (Annual Review of Astronomy 2022)",
      "u": "https://www.annualreviews.org/doi/10.1146/annurev-astro-052920-094029",
      "t": "deep"
    }
  ],
  "science_sections": [
    {
      "tab": "orbits",
      "section": "keplerian-orbit",
      "why": "Elke planeet, maan van een planeet, komeet en door mensen gemaakte ruimtevaartuig draait in een baan omdat de zwaartekracht van de Zon de centrale potentiaal bepaalt — een Kepleriaanse baan IS een baan rond de Zon."
    },
    {
      "tab": "orbits",
      "section": "keplers-laws",
      "why": "Kepler leidde zijn drie wetten af door Tycho's Marsgegevens op de zwaartekracht van de Zon aan te passen — zijn tweede wet (gelijke oppervlakken) zorgt ervoor dat binnenplaneten sneller zijn dan buitenplaneten."
    },
    {
      "tab": "scales-time",
      "section": "au",
      "why": "De astronomische eenheid is per definitie de gemiddelde Aarde-Zon-afstand — elke afstand in het zonnestelsel wordt ten opzichte van deze schaal uitgedrukt."
    },
    {
      "tab": "scales-time",
      "section": "ecliptic-plane",
      "why": "De evenaar van de Zon en het eclipticavlak zijn slechts 7,25° gekanteld — dicht genoeg dat 'banen in de ecliptica' een prima eerste benadering is voor bijna alles in het systeem."
    },
    {
      "tab": "scales-time",
      "section": "frames",
      "why": "Alle inertiaalstelels in de hemelmechanica van het zonnestelsel worden gedefinieerd ten opzichte van het barycentrum van de Zon — de rest van het systeem beweegt mee."
    }
  ]
}
