{
  "name": "Leucus",
  "type": "Planetoïde · Jupiter-trojaan · L4 · D-type · Langzame rotator",
  "fact": "Een van de traagst roterende bekende hemellichamen van zijn grootte — een rotatieperiode van 446 uur (18,6 dagen), ongewoon lang voor een asteroïde van 35 km. De trage rotatie wijst op een complexe geschiedenis van botsingen of getijdenwerking met een ander lichaam, mogelijk een recente (in geologische termen) grote gebeurtenis.",
  "bio": "Ontdekt in 1997, vernoemd naar Leucus (een strijdmakker van Odysseus, gedood bij Troje). Spectrale classificatie D — de donkerste en roodste van de Trojaanse familie. De ontmoeting van Lucy op 2028-04-18 brengt de vorm, de oppervlaktesamenstelling en de ontwikkeling van de rotatietoestand achter de trage rotatie in kaart.",
  "links": [
    {
      "l": "11351 Leucus — Wikipedia",
      "u": "https://en.wikipedia.org/wiki/11351_Leucus",
      "t": "intro"
    },
    {
      "l": "Lucy-missie (NASA)",
      "u": "https://science.nasa.gov/mission/lucy/",
      "t": "core"
    }
  ]
}
