{
  "name": "ディモルフォス",
  "type": "Asteroid · Moonlet · Kinetic-impact target",
  "fact": "人類が意図的に軌道を変えた初めての天体。NASAのDARTが2022年9月26日にディモルフォスに秒速6.14 km/sで衝突し、ディディモスの周りの11.9時間の軌道を33分短縮（4.2%）—成功の閾値を約25倍超え、惑星防御が可能であることを実証した。",
  "bio": "65803 ディディモスの160 mの小衛星で、2003年に発見。DART表面は「礫質流体」であることが判明し—宇宙船は接触の半秒間に表面に約50 cm沈み込み、運動量移動増強係数β ≈ 3.6は放出された表面物質からの有意な飛散を示唆した。CubeSat LICIACubeはリアルタイムでプルームを撮像；HSTとJWSTは数週間にわたってイジェクタプルームを観測した。",
  "links": [
    {
      "l": "Dimorphos — Wikipedia",
      "u": "https://en.wikipedia.org/wiki/Dimorphos",
      "t": "intro"
    },
    {
      "l": "DART の最終成果（NASA）",
      "u": "https://science.nasa.gov/mission/dart/",
      "t": "core"
    },
    {
      "l": "Daly et al. (2023) — 成功した運動エネルギー衝突（Nature）",
      "u": "https://www.nature.com/articles/s41586-023-05810-5",
      "t": "deep"
    }
  ]
}
