{
  "name": "एरोकोथ",
  "type": "काइपर घेरा पिंड · शीत-शास्त्रीय · संपर्क द्वैत",
  "fact": "किसी अंतरिक्ष यान द्वारा अब तक देखा गया सबसे दूर का पिंड — सूर्य से 4.1 बिलियन km दूर जब New Horizons नववर्ष दिवस 2019 को 3,500 km के भीतर से गुज़रा। इसकी दो पालियाँ (Wenu और Weeyo) सौर मंडल की भोर में धीरे से विलय हो गईं और ~40 K पर 4.5 बिलियन वर्षों तक विलयित रहीं।",
  "bio": "2014 में Hubble द्वारा खोजा गया और मूल रूप से 2014 MU69 के रूप में सूचीबद्ध। New Horizons उड़ान के बाद 2019 में एरोकोथ (Powhatan भाषा में 'आकाश') नाम दिया गया — ग्रहाणु डिस्क का एक प्राचीन अवशेष जो निर्माण के बाद से अपरिवर्तित संरक्षित है। इसका लाल, धीरे-संचित संपर्क-द्वैत आकार बाहरी सौर मंडल में ग्रह-निर्माण कैसे शुरू हुआ इसका प्रत्यक्ष निशान है।",
  "links": [
    {
      "l": "Arrokoth — Wikipedia",
      "u": "https://en.wikipedia.org/wiki/486958_Arrokoth",
      "t": "intro"
    },
    {
      "l": "एरोकोथ फ्लाईबाई (NASA New Horizons)",
      "u": "https://science.nasa.gov/solar-system/kuiper-belt/arrokoth-2014-mu69/",
      "t": "intro"
    },
    {
      "l": "एरोकोथ की शांत उत्पत्ति (NASA / Stern et al., Science 2020)",
      "u": "https://www.science.org/doi/10.1126/science.aay3999",
      "t": "core"
    },
    {
      "l": "Renaming 2014 MU69 → Arrokoth (NASA, 2019-11-12)",
      "u": "https://www.nasa.gov/missions/new-horizons/far-far-away-in-the-sky-new-horizons-kuiper-belt-flyby-object-officially-named-arrokoth/",
      "t": "deep"
    }
  ]
}
